GeneID,Acc_num,Main_Role,Subrole,Product,Gene,baseMean,log2FoldChange,lfcSE,stat,pvalue,padj
hotlake_ucc_69374,CY41DRAFT_0032,,,hypothetical protein,,11718.9929009602,-1.12835204319125,0.289706154569335,-3.89481557569465,9.82734723355918e-05,0.00632844077512028
hotlake_ucc_69963,CY41DRAFT_0598,,,carbon starvation protein CstA,cstA,2853.82929325882,-1.00388828872288,0.223527198903094,-4.49112364691734,7.08484037311545e-06,0.00067168222759564
hotlake_ucc_70100,CY41DRAFT_0732,,,histone deacetylase superfamily protein,hda,449.166873541314,-1.06743671334018,0.22836884587295,-4.6741783418831,2.95132790769611e-06,0.000335762738298895
hotlake_ucc_70144,CY41DRAFT_0773,Signal transduction,Taxis,chemotaxis signal relay system methyl-accepting signal transducer,mcp,1830.60626773784,-1.02980454856654,0.266944019693985,-3.8577547073243,0.000114433403939477,0.00723261495639693
hotlake_ucc_70788,CY41DRAFT_1374,,,ABC-type mannitol/sorbitol/arabinitol uptake system substrate-binding component MtlE,mtlE,792.193813177744,-1.08581353246347,0.302977340424974,-3.58381102342653,0.000338617117869823,0.0154093363105294
hotlake_ucc_70799,CY41DRAFT_1384,Amino acid metabolism::Carbohydrate metabolism,General::Phenylalanine_ tyrosine and tryptophan biosynthesis,gluconokinase GntK,gntK,145.105475750596,1.36351212968605,0.25965644659191,5.25121616498518,1.51098229171091e-07,2.71420134821544e-05
hotlake_ucc_70800,CY41DRAFT_1385,Transport and binding proteins,Unknown substrate::Carbohydrates_ organic alcohols_ and acids,TRAP-type gluconate uptake system large permease component GntZ,gntZ,378.01912752408,2.04484610436653,0.290029899379635,7.05046655100179,1.78318877283043e-12,8.69431897381464e-10
hotlake_ucc_70801,CY41DRAFT_1386,Transport and binding proteins,Carbohydrates_ organic alcohols_ and acids,TRAP-type gluconate uptake system small permease component GntY,gntY,140.234001812035,2.45993596620041,0.303061427618535,8.11695498675187,4.78025970288386e-16,4.07875659148565e-13
hotlake_ucc_70802,CY41DRAFT_1387,Transport and binding proteins,Carbohydrates_ organic alcohols_ and acids,TRAP-type gluconate uptake system substrate-binding component GntX,gntX,1150.99601417303,2.99276917650566,0.260675155393752,11.4808377959344,1.64677018508779e-30,1.87347554723487e-27
hotlake_ucc_70830,CY41DRAFT_1411,Prosthetic groups_ cofactors_ and carriers,Riboflavin metabolism,GTP cyclohydrolase II,ribA,1156.78801980305,-1.80702867651744,0.392044189283093,-4.60924744177904,4.04129125459976e-06,0.000405674325057323
hotlake_ucc_70831,CY41DRAFT_1412,Unknown function,General,predicted integral membrane protein,,2535.99720731532,-1.27416038097354,0.355145388054813,-3.58771484532662,0.000333588829746977,0.0153856577827896
hotlake_ucc_70861,CY41DRAFT_1442,Carbohydrate metabolism,Pyruvate metabolism,acetate kinase AckA,ackA,408.236842076136,1.00159398262545,0.202707948408912,4.94106911192743,7.76953598850548e-07,0.000126273458708425
hotlake_ucc_70960,CY41DRAFT_1532,Defense and invasion systems,General,CspA family cold shock protein,cspA,22140.4156212868,-1.18780770133676,0.281077575826922,-4.22590702172616,2.3798024600538e-05,0.00198104043808869
hotlake_ucc_71164,CY41DRAFT_1715,Unknown function,Enzymes of unknown specificity,alcohol dehydrogenase_ propanol-preferring,adhP,6175.10621172308,-1.33883511362876,0.375566527341614,-3.5648414226515,0.000364076243318641,0.0163498976111384
hotlake_ucc_71165,CY41DRAFT_1716,,,aldehyde dehydrogenase AldB,aldB,12222.2586908312,-2.44311484049063,0.416844338575992,-5.86097642308566,4.60153314846112e-09,1.20807943351522e-06
hotlake_ucc_71237,CY41DRAFT_1783,,,hypothetical protein,dnaQ,249.30715255103,-1.20541297117262,0.379111827677372,-3.17957099507441,0.00147493234271861,0.0424248519786568
hotlake_ucc_71238,CY41DRAFT_1784,Unknown function,General,CBS domain-containing protein,,1501.21649498611,-1.36263672112327,0.317455696275342,-4.29236815439405,1.76777521667948e-05,0.00154702995244283
hotlake_ucc_71239,CY41DRAFT_1785,Transport and binding proteins,Unknown substrate,putative solute:sodium symporter small subunit,,837.530784937777,-1.90715565419362,0.36284833153157,-5.25606841333287,1.471675633801e-07,2.71420134821544e-05
hotlake_ucc_71536,CY41DRAFT_2064,,,acid phosphatase superfamily protein,,245.189440339708,-1.06854714519046,0.340731178197578,-3.13604158810158,0.00171244918172797,0.0463856274383933
hotlake_ucc_71538,CY41DRAFT_2066,,,hypothetical protein,,10658.5316226455,-1.09938652129606,0.268486752304003,-4.09475146114936,4.22621502209021e-05,0.00320534930453198
hotlake_ucc_71539,CY41DRAFT_2067,,,,,1240.64090115424,-2.1526437927812,0.179137863767181,-12.0166878599095,2.90379248457117e-33,4.9553218749207e-30
hotlake_ucc_71540,CY41DRAFT_2068,Intracellular trafficking_ assembly_ and processing::Transport and binding proteins,Unknown substrate::Protein export_ secretion_ and sorting,RND family efflux transporter_ MFP subunit,,513.756451867051,-2.5398899766769,0.141525734608123,-17.9464885570791,5.11222122732618e-72,1.74480110488642e-68
hotlake_ucc_71625,CY41DRAFT_2151,Unknown function,Enzymes of unknown specificity,nitric oxide dioxygenase HmpA,hmpA,653.181318644948,4.61835287778884,0.609256750024329,7.58030645964024,3.44739674041463e-14,1.96099417917252e-11
hotlake_ucc_71744,CY41DRAFT_2268,Transport and binding proteins,Carbohydrates_ organic alcohols_ and acids::Amino acids_ peptides and amines,ABC-type urea uptake system permease component UrtC,urtC,51.3314368067794,-1.0461811116456,0.226234729626407,-4.6243170240626,3.75834679641088e-06,0.000388704170186374
hotlake_ucc_72140,CY41DRAFT_2632,,,protein of unknown function DUF2878,,556.875056561801,-1.74124694816581,0.371620542130549,-4.68555085298302,2.79207960315915e-06,0.00032859888570973
hotlake_ucc_72141,CY41DRAFT_2633,Fatty acid and lipid metabolism::Unknown function,Enzymes of unknown specificity::Biosynthesis,cyclopropane-fatty-acyl-phospholipid synthase,cfa,4021.77588628551,-1.43443201926237,0.301793963352122,-4.75301759958905,2.00402895836527e-06,0.000263067339803872
hotlake_ucc_72142,CY41DRAFT_2634,,,protein of unknown function DUF1365,,2687.52563435518,-1.13260617217924,0.333787068138438,-3.39319967815379,0.000690812618548337,0.0261704953947066
hotlake_ucc_72240,CY41DRAFT_2728,Signal transduction::Unknown function,Enzymes of unknown specificity::Two-component systems,nitrogen-responsive two component signal transduction system histidine kinase with PAS sensory domain NtrB,ntrB,409.616516400387,-1.106398738819,0.179990275414046,-6.14699175427039,7.89662324752527e-10,2.69511751438038e-07
hotlake_ucc_72444,CY41DRAFT_2926,,,hypothetical protein,,1462.36702821524,-1.14643074605435,0.215585505922126,-5.31775427643298,1.05055812538543e-07,2.10914993055321e-05
hotlake_ucc_72595,CY41DRAFT_3067,,,photoactive yellow protein Pyp,pyp,3009.09731570877,-1.21590494142835,0.246671569922651,-4.92924637326315,8.25474222445323e-07,0.000128061069145722
hotlake_ucc_72821,CY41DRAFT_3285,Defense and invasion systems,General,CspA family cold shock protein,cspA,55341.127465499,-1.10298645173714,0.340066776491601,-3.24344078276749,0.00118095356492931,0.0373203196028125
hotlake_ucc_72913,CY41DRAFT_3373,Amino acid metabolism,Phenylalanine_ tyrosine and tryptophan biosynthesis,tryptophan synthase_ beta subunit,trpB,20.389545084059,1.2194700771723,0.313094100397045,3.8948995705312,9.82394246690327e-05,0.00632844077512028
